{"architecture":"x86-64","assumptions":["One invocation of the localized entry; no concurrent mutation or library interposition.","System V x86-64 ABI and ordinary libc allocation, string and output semantics.","Decompiler types and referenced-data windows are uncertain recovery, not proven object bounds."],"calls":[{"caller":"0x401196","kind":"call","resolution":"external","site":"0x4011a7","target_address":"0x401090","target_entry":null,"target_name":"malloc"},{"caller":"0x401196","kind":"call","resolution":"external","site":"0x4011ca","target_address":"0x401080","target_entry":null,"target_name":"strcpy"},{"caller":"0x401196","kind":"call","resolution":"application","site":"0x4011d6","target_address":"0x4011ee","target_entry":"0x4011ee","target_name":"FUN_004011ee"},{"caller":"0x401196","kind":"call","resolution":"external","site":"0x4011e2","target_address":"0x401070","target_entry":null,"target_name":"free"},{"caller":"0x4011ee","kind":"call","resolution":"external","site":"0x40120a","target_address":"0x4010a0","target_entry":null,"target_name":"strcat"}],"completeness":{"data":"uncertain","decompilation":"complete","external_bodies":"excluded","localization":"private_entry_address","omissions":[],"traversal":"complete"},"data":[{"address":"0x402004","bytes":"68690070616464696e6770616464696e","extent_status":"unknown_window","interpretation":"uncertain_binary_recovery_not_an_object_bound","recovered_type":"unknown","references":["0x4011c2"],"size":16,"storage":"initialized","string_prefix":"hi","truncated":false,"writable":false},{"address":"0x402016","bytes":"6162630070616464696e677061646469","extent_status":"unknown_window","interpretation":"uncertain_binary_recovery_not_an_object_bound","recovered_type":"unknown","references":["0x401202"],"size":16,"storage":"initialized","string_prefix":"abc","truncated":false,"writable":false}],"entry_address":"0x401196","functions":[{"decompilation":{"status":"ok","text":"\nbool FUN_00401196(void)\n\n{\n  char *__dest;\n  \n  __dest = malloc(5);\n  if (__dest != (char *)0x0) {\n    strcpy(__dest,\"hi\");\n    FUN_004011ee(__dest);\n    free(__dest);\n  }\n  return __dest == (char *)0x0;\n}\n\n"},"entry":"0x401196","instructions":[{"address":"0x401196","bytes":"f30f1efa","mnemonic":"ENDBR64","operands":"","size":4},{"address":"0x40119a","bytes":"55","mnemonic":"PUSH","operands":"RBP","size":1},{"address":"0x40119b","bytes":"4889e5","mnemonic":"MOV","operands":"RBP,RSP","size":3},{"address":"0x40119e","bytes":"4883ec10","mnemonic":"SUB","operands":"RSP,0x10","size":4},{"address":"0x4011a2","bytes":"bf05000000","mnemonic":"MOV","operands":"EDI,0x5","size":5},{"address":"0x4011a7","bytes":"e8e4feffff","mnemonic":"CALL","operands":"0x00401090","size":5},{"address":"0x4011ac","bytes":"488945f8","mnemonic":"MOV","operands":"qword ptr [RBP + -0x8],RAX","size":4},{"address":"0x4011b0","bytes":"48837df800","mnemonic":"CMP","operands":"qword ptr [RBP + -0x8],0x0","size":5},{"address":"0x4011b5","bytes":"7507","mnemonic":"JNZ","operands":"0x004011be","size":2},{"address":"0x4011b7","bytes":"b801000000","mnemonic":"MOV","operands":"EAX,0x1","size":5},{"address":"0x4011bc","bytes":"eb2e","mnemonic":"JMP","operands":"0x004011ec","size":2},{"address":"0x4011be","bytes":"488b45f8","mnemonic":"MOV","operands":"RAX,qword ptr [RBP + -0x8]","size":4},{"address":"0x4011c2","bytes":"be04204000","mnemonic":"MOV","operands":"ESI,0x402004","size":5},{"address":"0x4011c7","bytes":"4889c7","mnemonic":"MOV","operands":"RDI,RAX","size":3},{"address":"0x4011ca","bytes":"e8b1feffff","mnemonic":"CALL","operands":"0x00401080","size":5},{"address":"0x4011cf","bytes":"488b45f8","mnemonic":"MOV","operands":"RAX,qword ptr [RBP + -0x8]","size":4},{"address":"0x4011d3","bytes":"4889c7","mnemonic":"MOV","operands":"RDI,RAX","size":3},{"address":"0x4011d6","bytes":"e813000000","mnemonic":"CALL","operands":"0x004011ee","size":5},{"address":"0x4011db","bytes":"488b45f8","mnemonic":"MOV","operands":"RAX,qword ptr [RBP + -0x8]","size":4},{"address":"0x4011df","bytes":"4889c7","mnemonic":"MOV","operands":"RDI,RAX","size":3},{"address":"0x4011e2","bytes":"e889feffff","mnemonic":"CALL","operands":"0x00401070","size":5},{"address":"0x4011e7","bytes":"b800000000","mnemonic":"MOV","operands":"EAX,0x0","size":5},{"address":"0x4011ec","bytes":"c9","mnemonic":"LEAVE","operands":"","size":1},{"address":"0x4011ed","bytes":"c3","mnemonic":"RET","operands":"","size":1}],"name":"FUN_00401196","name_origin":"default","ranges":[{"end":"0x4011ee","start":"0x401196"}]},{"decompilation":{"status":"ok","text":"\nvoid FUN_004011ee(char *param_1)\n\n{\n  strcat(param_1,\"abc\");\n  return;\n}\n\n"},"entry":"0x4011ee","instructions":[{"address":"0x4011ee","bytes":"f30f1efa","mnemonic":"ENDBR64","operands":"","size":4},{"address":"0x4011f2","bytes":"55","mnemonic":"PUSH","operands":"RBP","size":1},{"address":"0x4011f3","bytes":"4889e5","mnemonic":"MOV","operands":"RBP,RSP","size":3},{"address":"0x4011f6","bytes":"4883ec10","mnemonic":"SUB","operands":"RSP,0x10","size":4},{"address":"0x4011fa","bytes":"48897df8","mnemonic":"MOV","operands":"qword ptr [RBP + -0x8],RDI","size":4},{"address":"0x4011fe","bytes":"488b45f8","mnemonic":"MOV","operands":"RAX,qword ptr [RBP + -0x8]","size":4},{"address":"0x401202","bytes":"be16204000","mnemonic":"MOV","operands":"ESI,0x402016","size":5},{"address":"0x401207","bytes":"4889c7","mnemonic":"MOV","operands":"RDI,RAX","size":3},{"address":"0x40120a","bytes":"e891feffff","mnemonic":"CALL","operands":"0x004010a0","size":5},{"address":"0x40120f","bytes":"90","mnemonic":"NOP","operands":"","size":1},{"address":"0x401210","bytes":"c9","mnemonic":"LEAVE","operands":"","size":1},{"address":"0x401211","bytes":"c3","mnemonic":"RET","operands":"","size":1}],"name":"FUN_004011ee","name_origin":"default","ranges":[{"end":"0x401212","start":"0x4011ee"}]}],"policy_id":"entry-closure-v1","schema_version":2,"status":"available","unresolved_transfers":[]}
