{"schema_version":2,"architecture":"x86-64","policy_id":"entry-closure-v1","status":"available","entry_address":"0x401176","assumptions":["One invocation of the localized entry; no concurrent mutation or library interposition.","System V x86-64 ABI and ordinary libc allocation, string and output semantics.","Decompiler types and referenced-data windows are uncertain recovery, not proven object bounds."],"functions":[{"entry":"0x401176","name":"FUN_00401176","name_origin":"default","ranges":[{"start":"0x401176","end":"0x4011ab"}],"instructions":[{"address":"0x401176","size":4,"bytes":"f30f1efa","mnemonic":"ENDBR64","operands":""},{"address":"0x40117a","size":1,"bytes":"53","mnemonic":"PUSH","operands":"RBX"},{"address":"0x40117b","size":5,"bytes":"bf10000000","mnemonic":"MOV","operands":"EDI,0x10"},{"address":"0x401180","size":5,"bytes":"e8fbfeffff","mnemonic":"CALL","operands":"0x00401080"},{"address":"0x401185","size":3,"bytes":"4885c0","mnemonic":"TEST","operands":"RAX,RAX"},{"address":"0x401188","size":2,"bytes":"741a","mnemonic":"JZ","operands":"0x004011a4"},{"address":"0x40118a","size":3,"bytes":"4889c3","mnemonic":"MOV","operands":"RBX,RAX"},{"address":"0x40118d","size":3,"bytes":"4889c7","mnemonic":"MOV","operands":"RDI,RAX"},{"address":"0x401190","size":5,"bytes":"e816000000","mnemonic":"CALL","operands":"0x004011ab"},{"address":"0x401195","size":3,"bytes":"4889df","mnemonic":"MOV","operands":"RDI,RBX"},{"address":"0x401198","size":5,"bytes":"e8c3feffff","mnemonic":"CALL","operands":"0x00401060"},{"address":"0x40119d","size":5,"bytes":"b800000000","mnemonic":"MOV","operands":"EAX,0x0"},{"address":"0x4011a2","size":1,"bytes":"5b","mnemonic":"POP","operands":"RBX"},{"address":"0x4011a3","size":1,"bytes":"c3","mnemonic":"RET","operands":""},{"address":"0x4011a4","size":5,"bytes":"b801000000","mnemonic":"MOV","operands":"EAX,0x1"},{"address":"0x4011a9","size":2,"bytes":"ebf7","mnemonic":"JMP","operands":"0x004011a2"}],"decompilation":{"status":"ok","text":"\nbool FUN_00401176(void)\n\n{\n  void *__ptr;\n  \n  __ptr = malloc(0x10);\n  if (__ptr != (void *)0x0) {\n    FUN_004011ab(__ptr);\n    free(__ptr);\n  }\n  return __ptr == (void *)0x0;\n}\n\n"}},{"entry":"0x4011ab","name":"FUN_004011ab","name_origin":"default","ranges":[{"start":"0x4011ab","end":"0x4011c7"}],"instructions":[{"address":"0x4011ab","size":4,"bytes":"f30f1efa","mnemonic":"ENDBR64","operands":""},{"address":"0x4011af","size":4,"bytes":"4883ec08","mnemonic":"SUB","operands":"RSP,0x8"},{"address":"0x4011b3","size":5,"bytes":"ba03000000","mnemonic":"MOV","operands":"EDX,0x3"},{"address":"0x4011b8","size":5,"bytes":"be41000000","mnemonic":"MOV","operands":"ESI,0x41"},{"address":"0x4011bd","size":5,"bytes":"e8aefeffff","mnemonic":"CALL","operands":"0x00401070"},{"address":"0x4011c2","size":4,"bytes":"4883c408","mnemonic":"ADD","operands":"RSP,0x8"},{"address":"0x4011c6","size":1,"bytes":"c3","mnemonic":"RET","operands":""}],"decompilation":{"status":"ok","text":"\nvoid FUN_004011ab(wchar_t *param_1)\n\n{\n  wmemset(param_1,L'A',3);\n  return;\n}\n\n"}}],"calls":[{"caller":"0x401176","site":"0x401180","target_address":"0x401080","target_name":"malloc","kind":"call","resolution":"external","target_entry":null},{"caller":"0x401176","site":"0x401190","target_address":"0x4011ab","target_name":"FUN_004011ab","kind":"call","resolution":"application","target_entry":"0x4011ab"},{"caller":"0x401176","site":"0x401198","target_address":"0x401060","target_name":"free","kind":"call","resolution":"external","target_entry":null},{"caller":"0x4011ab","site":"0x4011bd","target_address":"0x401070","target_name":"wmemset","kind":"call","resolution":"external","target_entry":null}],"data":[],"unresolved_transfers":[],"completeness":{"traversal":"complete","data":"complete","decompilation":"complete","external_bodies":"excluded","localization":"private_entry_address","omissions":[]}}
