{"architecture":"x86-64","assumptions":["One invocation of the localized entry; no concurrent mutation or library interposition.","System V x86-64 ABI and ordinary libc allocation, string and output semantics.","Decompiler types and referenced-data windows are uncertain recovery, not proven object bounds."],"calls":[{"caller":"0x4010c0","kind":"call","resolution":"application","site":"0x4010c6","target_address":"0x4011d0","target_entry":"0x4011d0","target_name":"process_case"},{"caller":"0x4011d0","kind":"call","resolution":"external","site":"0x4011ee","target_address":"0x401060","target_entry":null,"target_name":"wmemset"},{"caller":"0x4011d0","kind":"call","resolution":"application","site":"0x401201","target_address":"0x401290","target_entry":"0x401290","target_name":"printWLine"},{"caller":"0x401290","kind":"tail","resolution":"external","site":"0x40129f","target_address":"0x401080","target_entry":null,"target_name":"wprintf"}],"completeness":{"data":"uncertain","decompilation":"complete","external_bodies":"excluded","localization":"private_entry_address","omissions":[],"traversal":"complete"},"data":[{"address":"0x402004","bytes":"250000006c000000730000000a000000","extent_status":"unknown_window","interpretation":"uncertain_binary_recovery_not_an_object_bound","recovered_type":"unknown","references":["0x40129a"],"size":16,"storage":"initialized","string_prefix":"%","truncated":false,"writable":false},{"address":"0x404068","bytes":"00000000000000000000000000000000","extent_status":"unknown_window","interpretation":"uncertain_binary_recovery_not_an_object_bound","recovered_type":"unknown","references":["0x4011e1"],"size":16,"storage":"zero_filled","string_prefix":null,"truncated":false,"writable":true}],"entry_address":"0x4010c0","functions":[{"decompilation":{"status":"ok","text":"\nundefined8 main(void)\n\n{\n  process_case();\n  return 0;\n}\n\n"},"entry":"0x4010c0","instructions":[{"address":"0x4010c0","bytes":"4883ec08","mnemonic":"SUB","operands":"RSP,0x8","size":4},{"address":"0x4010c4","bytes":"31c0","mnemonic":"XOR","operands":"EAX,EAX","size":2},{"address":"0x4010c6","bytes":"e805010000","mnemonic":"CALL","operands":"0x004011d0","size":5},{"address":"0x4010cb","bytes":"31c0","mnemonic":"XOR","operands":"EAX,EAX","size":2},{"address":"0x4010cd","bytes":"4883c408","mnemonic":"ADD","operands":"RSP,0x8","size":4},{"address":"0x4010d1","bytes":"c3","mnemonic":"RET","operands":"","size":1}],"name":"main","name_origin":"imported","ranges":[{"end":"0x4010d2","start":"0x4010c0"}]},{"decompilation":{"status":"ok","text":"\nvoid process_case(void)\n\n{\n  wchar_t awStack_198 [49];\n  undefined4 local_d4;\n  \n  flow_component_03 = 0;\n  wmemset(awStack_198,L'A',0x31);\n  local_d4 = 0;\n  printWLine(awStack_198);\n  return;\n}\n\n"},"entry":"0x4011d0","instructions":[{"address":"0x4011d0","bytes":"4881ec98010000","mnemonic":"SUB","operands":"RSP,0x198","size":7},{"address":"0x4011d7","bytes":"ba31000000","mnemonic":"MOV","operands":"EDX,0x31","size":5},{"address":"0x4011dc","bytes":"be41000000","mnemonic":"MOV","operands":"ESI,0x41","size":5},{"address":"0x4011e1","bytes":"c7057d2e000000000000","mnemonic":"MOV","operands":"dword ptr [0x00404068],0x0","size":10},{"address":"0x4011eb","bytes":"4889e7","mnemonic":"MOV","operands":"RDI,RSP","size":3},{"address":"0x4011ee","bytes":"e86dfeffff","mnemonic":"CALL","operands":"0x00401060","size":5},{"address":"0x4011f3","bytes":"4889e7","mnemonic":"MOV","operands":"RDI,RSP","size":3},{"address":"0x4011f6","bytes":"c78424c400000000000000","mnemonic":"MOV","operands":"dword ptr [RSP + 0xc4],0x0","size":11},{"address":"0x401201","bytes":"e88a000000","mnemonic":"CALL","operands":"0x00401290","size":5},{"address":"0x401206","bytes":"4881c498010000","mnemonic":"ADD","operands":"RSP,0x198","size":7},{"address":"0x40120d","bytes":"c3","mnemonic":"RET","operands":"","size":1}],"name":"process_case","name_origin":"imported","ranges":[{"end":"0x40120e","start":"0x4011d0"}]},{"decompilation":{"status":"ok","text":"\nvoid printWLine(long param_1)\n\n{\n  if (param_1 != 0) {\n    wprintf(L\"%ls\\n\",param_1);\n    return;\n  }\n  return;\n}\n\n"},"entry":"0x401290","instructions":[{"address":"0x401290","bytes":"4885ff","mnemonic":"TEST","operands":"RDI,RDI","size":3},{"address":"0x401293","bytes":"7413","mnemonic":"JZ","operands":"0x004012a8","size":2},{"address":"0x401295","bytes":"4889fe","mnemonic":"MOV","operands":"RSI,RDI","size":3},{"address":"0x401298","bytes":"31c0","mnemonic":"XOR","operands":"EAX,EAX","size":2},{"address":"0x40129a","bytes":"bf04204000","mnemonic":"MOV","operands":"EDI,0x402004","size":5},{"address":"0x40129f","bytes":"e9dcfdffff","mnemonic":"JMP","operands":"0x00401080","size":5},{"address":"0x4012a8","bytes":"c3","mnemonic":"RET","operands":"","size":1}],"name":"printWLine","name_origin":"imported","ranges":[{"end":"0x4012a4","start":"0x401290"},{"end":"0x4012a9","start":"0x4012a8"}]}],"policy_id":"entry-closure-v1","schema_version":2,"status":"available","unresolved_transfers":[]}
