{"architecture":"x86-64","assumptions":["One invocation of the localized entry; no concurrent mutation or library interposition.","System V x86-64 ABI and ordinary libc allocation, string and output semantics.","Decompiler types and referenced-data windows are uncertain recovery, not proven object bounds."],"calls":[{"caller":"0x401176","kind":"call","resolution":"external","site":"0x401180","target_address":"0x401080","target_entry":null,"target_name":"malloc"},{"caller":"0x401176","kind":"call","resolution":"application","site":"0x401190","target_address":"0x4011ab","target_entry":"0x4011ab","target_name":"apply"},{"caller":"0x401176","kind":"call","resolution":"external","site":"0x401198","target_address":"0x401060","target_entry":null,"target_name":"free"},{"caller":"0x4011ab","kind":"call","resolution":"external","site":"0x4011b8","target_address":"0x401070","target_entry":null,"target_name":"wcscpy"}],"completeness":{"data":"uncertain","decompilation":"complete","external_bodies":"excluded","localization":"private_entry_address","omissions":[],"traversal":"complete"},"data":[{"address":"0x402004","bytes":"41000000420000000000000000000000","extent_status":"unknown_window","interpretation":"uncertain_binary_recovery_not_an_object_bound","recovered_type":"unknown","references":["0x4011b3"],"size":16,"storage":"initialized","string_prefix":"A","truncated":false,"writable":false}],"entry_address":"0x401176","functions":[{"decompilation":{"status":"ok","text":"\nbool main(void)\n\n{\n  void *__ptr;\n  \n  __ptr = malloc(0x10);\n  if (__ptr != (void *)0x0) {\n    apply(__ptr);\n    free(__ptr);\n  }\n  return __ptr == (void *)0x0;\n}\n\n"},"entry":"0x401176","instructions":[{"address":"0x401176","bytes":"f30f1efa","mnemonic":"ENDBR64","operands":"","size":4},{"address":"0x40117a","bytes":"53","mnemonic":"PUSH","operands":"RBX","size":1},{"address":"0x40117b","bytes":"bf10000000","mnemonic":"MOV","operands":"EDI,0x10","size":5},{"address":"0x401180","bytes":"e8fbfeffff","mnemonic":"CALL","operands":"0x00401080","size":5},{"address":"0x401185","bytes":"4885c0","mnemonic":"TEST","operands":"RAX,RAX","size":3},{"address":"0x401188","bytes":"741a","mnemonic":"JZ","operands":"0x004011a4","size":2},{"address":"0x40118a","bytes":"4889c3","mnemonic":"MOV","operands":"RBX,RAX","size":3},{"address":"0x40118d","bytes":"4889c7","mnemonic":"MOV","operands":"RDI,RAX","size":3},{"address":"0x401190","bytes":"e816000000","mnemonic":"CALL","operands":"0x004011ab","size":5},{"address":"0x401195","bytes":"4889df","mnemonic":"MOV","operands":"RDI,RBX","size":3},{"address":"0x401198","bytes":"e8c3feffff","mnemonic":"CALL","operands":"0x00401060","size":5},{"address":"0x40119d","bytes":"b800000000","mnemonic":"MOV","operands":"EAX,0x0","size":5},{"address":"0x4011a2","bytes":"5b","mnemonic":"POP","operands":"RBX","size":1},{"address":"0x4011a3","bytes":"c3","mnemonic":"RET","operands":"","size":1},{"address":"0x4011a4","bytes":"b801000000","mnemonic":"MOV","operands":"EAX,0x1","size":5},{"address":"0x4011a9","bytes":"ebf7","mnemonic":"JMP","operands":"0x004011a2","size":2}],"name":"main","name_origin":"imported","ranges":[{"end":"0x4011ab","start":"0x401176"}]},{"decompilation":{"status":"ok","text":"\nvoid apply(wchar_t *param_1)\n\n{\n  wcscpy(param_1,L\"AB\");\n  return;\n}\n\n"},"entry":"0x4011ab","instructions":[{"address":"0x4011ab","bytes":"f30f1efa","mnemonic":"ENDBR64","operands":"","size":4},{"address":"0x4011af","bytes":"4883ec08","mnemonic":"SUB","operands":"RSP,0x8","size":4},{"address":"0x4011b3","bytes":"be04204000","mnemonic":"MOV","operands":"ESI,0x402004","size":5},{"address":"0x4011b8","bytes":"e8b3feffff","mnemonic":"CALL","operands":"0x00401070","size":5},{"address":"0x4011bd","bytes":"4883c408","mnemonic":"ADD","operands":"RSP,0x8","size":4},{"address":"0x4011c1","bytes":"c3","mnemonic":"RET","operands":"","size":1}],"name":"apply","name_origin":"imported","ranges":[{"end":"0x4011c2","start":"0x4011ab"}]}],"policy_id":"entry-closure-v1","schema_version":2,"status":"available","unresolved_transfers":[]}
