{"architecture":"x86-64","assumptions":["One invocation of the localized entry; no concurrent mutation or library interposition.","System V x86-64 ABI and ordinary libc allocation, string and output semantics.","Decompiler types and referenced-data windows are uncertain recovery, not proven object bounds."],"calls":[{"caller":"0x4010e0","kind":"call","resolution":"application","site":"0x4010f3","target_address":"0x401280","target_entry":"0x401280","target_name":"printLine"},{"caller":"0x401280","kind":"tail","resolution":"external","site":"0x401285","target_address":"0x401040","target_entry":null,"target_name":"puts"}],"completeness":{"data":"uncertain","decompilation":"complete","external_bodies":"excluded","localization":"private_entry_address","omissions":[],"traversal":"complete"},"data":[{"address":"0x402008","bytes":"4552524f523a20417272617920696e646578206973206f75742d6f662d626f756e647300","extent_status":"recovered_type_extent","interpretation":"uncertain_binary_recovery_not_an_object_bound","recovered_type":"string","references":["0x4010e4"],"size":36,"storage":"initialized","string_prefix":"ERROR: Array index is out-of-bounds","truncated":false,"writable":false},{"address":"0x40407c","bytes":"00000000000000000000000000000000","extent_status":"unknown_window","interpretation":"uncertain_binary_recovery_not_an_object_bound","recovered_type":"unknown","references":["0x4010e9"],"size":16,"storage":"zero_filled","string_prefix":null,"truncated":false,"writable":true}],"entry_address":"0x4010e0","functions":[{"decompilation":{"status":"ok","text":"\nundefined8 main(void)\n\n{\n  flow_gate = 0;\n  printLine(\"ERROR: Array index is out-of-bounds\");\n  return 0;\n}\n\n"},"entry":"0x4010e0","instructions":[{"address":"0x4010e0","bytes":"4883ec08","mnemonic":"SUB","operands":"RSP,0x8","size":4},{"address":"0x4010e4","bytes":"bf08204000","mnemonic":"MOV","operands":"EDI,0x402008","size":5},{"address":"0x4010e9","bytes":"c705892f000000000000","mnemonic":"MOV","operands":"dword ptr [0x0040407c],0x0","size":10},{"address":"0x4010f3","bytes":"e888010000","mnemonic":"CALL","operands":"0x00401280","size":5},{"address":"0x4010f8","bytes":"31c0","mnemonic":"XOR","operands":"EAX,EAX","size":2},{"address":"0x4010fa","bytes":"4883c408","mnemonic":"ADD","operands":"RSP,0x8","size":4},{"address":"0x4010fe","bytes":"c3","mnemonic":"RET","operands":"","size":1}],"name":"main","name_origin":"imported","ranges":[{"end":"0x4010ff","start":"0x4010e0"}]},{"decompilation":{"status":"ok","text":"\nvoid printLine(char *param_1)\n\n{\n  if (param_1 != (char *)0x0) {\n    puts(param_1);\n    return;\n  }\n  return;\n}\n\n"},"entry":"0x401280","instructions":[{"address":"0x401280","bytes":"4885ff","mnemonic":"TEST","operands":"RDI,RDI","size":3},{"address":"0x401283","bytes":"740b","mnemonic":"JZ","operands":"0x00401290","size":2},{"address":"0x401285","bytes":"e9b6fdffff","mnemonic":"JMP","operands":"0x00401040","size":5},{"address":"0x401290","bytes":"c3","mnemonic":"RET","operands":"","size":1}],"name":"printLine","name_origin":"imported","ranges":[{"end":"0x40128a","start":"0x401280"},{"end":"0x401291","start":"0x401290"}]}],"policy_id":"entry-closure-v1","schema_version":2,"status":"available","unresolved_transfers":[]}
