{"architecture":"x86-64","assumptions":["One invocation of the localized entry; no concurrent mutation or library interposition.","System V x86-64 ABI and ordinary libc allocation, string and output semantics.","Decompiler types and referenced-data windows are uncertain recovery, not proven object bounds."],"calls":[{"caller":"0x4010b0","kind":"call","resolution":"external","site":"0x4010ba","target_address":"0x401090","target_entry":null,"target_name":"malloc"},{"caller":"0x4010b0","kind":"call","resolution":"external","site":"0x4010cf","target_address":"0x401080","target_entry":null,"target_name":"strcpy"},{"caller":"0x4010b0","kind":"call","resolution":"application","site":"0x4010d7","target_address":"0x4011e0","target_entry":"0x4011e0","target_name":"FUN_004011e0"},{"caller":"0x4010b0","kind":"call","resolution":"external","site":"0x4010df","target_address":"0x401070","target_entry":null,"target_name":"free"},{"caller":"0x4011e0","kind":"tail","resolution":"external","site":"0x4011e9","target_address":"0x4010a0","target_entry":null,"target_name":"strcat"}],"completeness":{"data":"uncertain","decompilation":"complete","external_bodies":"excluded","localization":"private_entry_address","omissions":[],"traversal":"complete"},"data":[{"address":"0x402004","bytes":"68690070616464696e6770616464696e","extent_status":"unknown_window","interpretation":"uncertain_binary_recovery_not_an_object_bound","recovered_type":"unknown","references":["0x4010c7"],"size":16,"storage":"initialized","string_prefix":"hi","truncated":false,"writable":false},{"address":"0x402016","bytes":"6162630070616464696e677061646469","extent_status":"unknown_window","interpretation":"uncertain_binary_recovery_not_an_object_bound","recovered_type":"unknown","references":["0x4011e4"],"size":16,"storage":"initialized","string_prefix":"abc","truncated":false,"writable":false}],"entry_address":"0x4010b0","functions":[{"decompilation":{"status":"ok","text":"\nundefined8 FUN_004010b0(void)\n\n{\n  char *__dest;\n  \n  __dest = malloc(5);\n  if (__dest != (char *)0x0) {\n    strcpy(__dest,\"hi\");\n    FUN_004011e0(__dest);\n    free(__dest);\n    return 0;\n  }\n  return 1;\n}\n\n"},"entry":"0x4010b0","instructions":[{"address":"0x4010b0","bytes":"f30f1efa","mnemonic":"ENDBR64","operands":"","size":4},{"address":"0x4010b4","bytes":"53","mnemonic":"PUSH","operands":"RBX","size":1},{"address":"0x4010b5","bytes":"bf05000000","mnemonic":"MOV","operands":"EDI,0x5","size":5},{"address":"0x4010ba","bytes":"e8d1ffffff","mnemonic":"CALL","operands":"0x00401090","size":5},{"address":"0x4010bf","bytes":"4885c0","mnemonic":"TEST","operands":"RAX,RAX","size":3},{"address":"0x4010c2","bytes":"7424","mnemonic":"JZ","operands":"0x004010e8","size":2},{"address":"0x4010c4","bytes":"4889c3","mnemonic":"MOV","operands":"RBX,RAX","size":3},{"address":"0x4010c7","bytes":"be04204000","mnemonic":"MOV","operands":"ESI,0x402004","size":5},{"address":"0x4010cc","bytes":"4889c7","mnemonic":"MOV","operands":"RDI,RAX","size":3},{"address":"0x4010cf","bytes":"e8acffffff","mnemonic":"CALL","operands":"0x00401080","size":5},{"address":"0x4010d4","bytes":"4889df","mnemonic":"MOV","operands":"RDI,RBX","size":3},{"address":"0x4010d7","bytes":"e804010000","mnemonic":"CALL","operands":"0x004011e0","size":5},{"address":"0x4010dc","bytes":"4889df","mnemonic":"MOV","operands":"RDI,RBX","size":3},{"address":"0x4010df","bytes":"e88cffffff","mnemonic":"CALL","operands":"0x00401070","size":5},{"address":"0x4010e4","bytes":"31c0","mnemonic":"XOR","operands":"EAX,EAX","size":2},{"address":"0x4010e6","bytes":"5b","mnemonic":"POP","operands":"RBX","size":1},{"address":"0x4010e7","bytes":"c3","mnemonic":"RET","operands":"","size":1},{"address":"0x4010e8","bytes":"b801000000","mnemonic":"MOV","operands":"EAX,0x1","size":5},{"address":"0x4010ed","bytes":"5b","mnemonic":"POP","operands":"RBX","size":1},{"address":"0x4010ee","bytes":"c3","mnemonic":"RET","operands":"","size":1}],"name":"FUN_004010b0","name_origin":"default","ranges":[{"end":"0x4010ef","start":"0x4010b0"}]},{"decompilation":{"status":"ok","text":"\nvoid FUN_004011e0(char *param_1)\n\n{\n  strcat(param_1,\"abc\");\n  return;\n}\n\n"},"entry":"0x4011e0","instructions":[{"address":"0x4011e0","bytes":"f30f1efa","mnemonic":"ENDBR64","operands":"","size":4},{"address":"0x4011e4","bytes":"be16204000","mnemonic":"MOV","operands":"ESI,0x402016","size":5},{"address":"0x4011e9","bytes":"e9b2feffff","mnemonic":"JMP","operands":"0x004010a0","size":5}],"name":"FUN_004011e0","name_origin":"default","ranges":[{"end":"0x4011ee","start":"0x4011e0"}]}],"policy_id":"entry-closure-v1","schema_version":2,"status":"available","unresolved_transfers":[]}
