{"schema_version":2,"architecture":"x86-64","policy_id":"entry-closure-v1","status":"available","entry_address":"0x401050","assumptions":["One invocation of the localized entry; no concurrent mutation or library interposition.","System V x86-64 ABI and ordinary libc allocation, string and output semantics.","Decompiler types and referenced-data windows are uncertain recovery, not proven object bounds."],"functions":[{"entry":"0x401050","name":"main","name_origin":"imported","ranges":[{"start":"0x401050","end":"0x401066"}],"instructions":[{"address":"0x401050","size":4,"bytes":"f30f1efa","mnemonic":"ENDBR64","operands":""},{"address":"0x401054","size":4,"bytes":"4883ec08","mnemonic":"SUB","operands":"RSP,0x8"},{"address":"0x401058","size":2,"bytes":"31ff","mnemonic":"XOR","operands":"EDI,EDI"},{"address":"0x40105a","size":5,"bytes":"e801010000","mnemonic":"CALL","operands":"0x00401160"},{"address":"0x40105f","size":2,"bytes":"31c0","mnemonic":"XOR","operands":"EAX,EAX"},{"address":"0x401061","size":4,"bytes":"4883c408","mnemonic":"ADD","operands":"RSP,0x8"},{"address":"0x401065","size":1,"bytes":"c3","mnemonic":"RET","operands":""}],"decompilation":{"status":"ok","text":"\nundefined8 main(void)\n\n{\n  apply(0);\n  return 0;\n}\n\n"}},{"entry":"0x401160","name":"apply","name_origin":"imported","ranges":[{"start":"0x401160","end":"0x401175"}],"instructions":[{"address":"0x401160","size":4,"bytes":"f30f1efa","mnemonic":"ENDBR64","operands":""},{"address":"0x401164","size":5,"bytes":"be04204000","mnemonic":"MOV","operands":"ESI,0x402004"},{"address":"0x401169","size":5,"bytes":"bf14204000","mnemonic":"MOV","operands":"EDI,0x402014"},{"address":"0x40116e","size":2,"bytes":"31c0","mnemonic":"XOR","operands":"EAX,EAX"},{"address":"0x401170","size":5,"bytes":"e9cbfeffff","mnemonic":"JMP","operands":"0x00401040"}],"decompilation":{"status":"ok","text":"\nvoid apply(void)\n\n{\n  wprintf(L\"%ls\",&DAT_00402004);\n  return;\n}\n\n"}}],"calls":[{"caller":"0x401050","site":"0x40105a","target_address":"0x401160","target_name":"apply","kind":"call","resolution":"application","target_entry":"0x401160"},{"caller":"0x401160","site":"0x401170","target_address":"0x401040","target_name":"wprintf","kind":"tail","resolution":"external","target_entry":null}],"data":[{"address":"0x402004","bytes":"4f0000004b0000000000000000000000","string_prefix":"O","size":16,"writable":false,"storage":"initialized","extent_status":"unknown_window","recovered_type":"unknown","interpretation":"uncertain_binary_recovery_not_an_object_bound","references":["0x401164"],"truncated":false},{"address":"0x402014","bytes":"250000006c0000007300000000000000","string_prefix":"%","size":16,"writable":false,"storage":"initialized","extent_status":"unknown_window","recovered_type":"unknown","interpretation":"uncertain_binary_recovery_not_an_object_bound","references":["0x401169"],"truncated":false}],"unresolved_transfers":[],"completeness":{"traversal":"complete","data":"uncertain","decompilation":"complete","external_bodies":"excluded","localization":"private_entry_address","omissions":[]}}
