{"architecture":"x86-64","assumptions":["One invocation of the localized entry; no concurrent mutation or library interposition.","System V x86-64 ABI and ordinary libc allocation, string and output semantics.","Decompiler types and referenced-data windows are uncertain recovery, not proven object bounds."],"calls":[{"caller":"0x401196","kind":"call","resolution":"application","site":"0x40119f","target_address":"0x401262","target_entry":"0x401262","target_name":"FUN_00401262"},{"caller":"0x4011a9","kind":"call","resolution":"application","site":"0x4011b2","target_address":"0x401196","target_entry":"0x401196","target_name":"FUN_00401196"},{"caller":"0x401262","kind":"call","resolution":"external","site":"0x401273","target_address":"0x401050","target_entry":null,"target_name":"printf"}],"completeness":{"data":"uncertain","decompilation":"complete","external_bodies":"excluded","localization":"private_entry_address","omissions":[],"traversal":"complete"},"data":[{"address":"0x402035","bytes":"256c640a00257a750a00253032780a00","extent_status":"unknown_window","interpretation":"uncertain_binary_recovery_not_an_object_bound","recovered_type":"unknown","references":["0x401269"],"size":16,"storage":"initialized","string_prefix":"%ld\n","truncated":false,"writable":false}],"entry_address":"0x4011a9","functions":[{"decompilation":{"status":"ok","text":"\nvoid FUN_00401196(void)\n\n{\n  FUN_00401262(0x7ffffffb);\n  return;\n}\n\n"},"entry":"0x401196","instructions":[{"address":"0x401196","bytes":"4883ec08","mnemonic":"SUB","operands":"RSP,0x8","size":4},{"address":"0x40119a","bytes":"bffbffff7f","mnemonic":"MOV","operands":"EDI,0x7ffffffb","size":5},{"address":"0x40119f","bytes":"e8be000000","mnemonic":"CALL","operands":"0x00401262","size":5},{"address":"0x4011a4","bytes":"4883c408","mnemonic":"ADD","operands":"RSP,0x8","size":4},{"address":"0x4011a8","bytes":"c3","mnemonic":"RET","operands":"","size":1}],"name":"FUN_00401196","name_origin":"default","ranges":[{"end":"0x4011a9","start":"0x401196"}]},{"decompilation":{"status":"ok","text":"\nundefined8 FUN_004011a9(void)\n\n{\n  FUN_00401196();\n  return 0;\n}\n\n"},"entry":"0x4011a9","instructions":[{"address":"0x4011a9","bytes":"4883ec08","mnemonic":"SUB","operands":"RSP,0x8","size":4},{"address":"0x4011ad","bytes":"b800000000","mnemonic":"MOV","operands":"EAX,0x0","size":5},{"address":"0x4011b2","bytes":"e8dfffffff","mnemonic":"CALL","operands":"0x00401196","size":5},{"address":"0x4011b7","bytes":"b800000000","mnemonic":"MOV","operands":"EAX,0x0","size":5},{"address":"0x4011bc","bytes":"4883c408","mnemonic":"ADD","operands":"RSP,0x8","size":4},{"address":"0x4011c0","bytes":"c3","mnemonic":"RET","operands":"","size":1}],"name":"FUN_004011a9","name_origin":"default","ranges":[{"end":"0x4011c1","start":"0x4011a9"}]},{"decompilation":{"status":"ok","text":"\nvoid FUN_00401262(undefined8 param_1)\n\n{\n  printf(\"%ld\\n\",param_1);\n  return;\n}\n\n"},"entry":"0x401262","instructions":[{"address":"0x401262","bytes":"4883ec08","mnemonic":"SUB","operands":"RSP,0x8","size":4},{"address":"0x401266","bytes":"4889fe","mnemonic":"MOV","operands":"RSI,RDI","size":3},{"address":"0x401269","bytes":"bf35204000","mnemonic":"MOV","operands":"EDI,0x402035","size":5},{"address":"0x40126e","bytes":"b800000000","mnemonic":"MOV","operands":"EAX,0x0","size":5},{"address":"0x401273","bytes":"e8d8fdffff","mnemonic":"CALL","operands":"0x00401050","size":5},{"address":"0x401278","bytes":"4883c408","mnemonic":"ADD","operands":"RSP,0x8","size":4},{"address":"0x40127c","bytes":"c3","mnemonic":"RET","operands":"","size":1}],"name":"FUN_00401262","name_origin":"default","ranges":[{"end":"0x40127d","start":"0x401262"}]}],"policy_id":"entry-closure-v1","schema_version":2,"status":"available","unresolved_transfers":[]}
