{"architecture":"x86-64","assumptions":["One invocation of the localized entry; no concurrent mutation or library interposition.","System V x86-64 ABI and ordinary libc allocation, string and output semantics.","Decompiler types and referenced-data windows are uncertain recovery, not proven object bounds."],"calls":[{"caller":"0x401196","kind":"call","resolution":"external","site":"0x4011a0","target_address":"0x4010a0","target_entry":null,"target_name":"malloc"},{"caller":"0x401196","kind":"call","resolution":"application","site":"0x4011b0","target_address":"0x4011cb","target_entry":"0x4011cb","target_name":"apply"},{"caller":"0x401196","kind":"call","resolution":"external","site":"0x4011b8","target_address":"0x401070","target_entry":null,"target_name":"free"},{"caller":"0x4011cb","kind":"call","resolution":"external","site":"0x4011d8","target_address":"0x401080","target_entry":null,"target_name":"wcslen"},{"caller":"0x4011cb","kind":"call","resolution":"external","site":"0x4011e9","target_address":"0x401090","target_entry":null,"target_name":"wmemset"}],"completeness":{"data":"uncertain","decompilation":"complete","external_bodies":"excluded","localization":"private_entry_address","omissions":[],"traversal":"complete"},"data":[{"address":"0x402004","bytes":"41000000420000000000000000000000","extent_status":"unknown_window","interpretation":"uncertain_binary_recovery_not_an_object_bound","recovered_type":"unknown","references":["0x4011d3"],"size":16,"storage":"initialized","string_prefix":"A","truncated":false,"writable":false}],"entry_address":"0x401196","functions":[{"decompilation":{"status":"ok","text":"\nbool main(void)\n\n{\n  void *__ptr;\n  \n  __ptr = malloc(8);\n  if (__ptr != (void *)0x0) {\n    apply(__ptr);\n    free(__ptr);\n  }\n  return __ptr == (void *)0x0;\n}\n\n"},"entry":"0x401196","instructions":[{"address":"0x401196","bytes":"f30f1efa","mnemonic":"ENDBR64","operands":"","size":4},{"address":"0x40119a","bytes":"53","mnemonic":"PUSH","operands":"RBX","size":1},{"address":"0x40119b","bytes":"bf08000000","mnemonic":"MOV","operands":"EDI,0x8","size":5},{"address":"0x4011a0","bytes":"e8fbfeffff","mnemonic":"CALL","operands":"0x004010a0","size":5},{"address":"0x4011a5","bytes":"4885c0","mnemonic":"TEST","operands":"RAX,RAX","size":3},{"address":"0x4011a8","bytes":"741a","mnemonic":"JZ","operands":"0x004011c4","size":2},{"address":"0x4011aa","bytes":"4889c3","mnemonic":"MOV","operands":"RBX,RAX","size":3},{"address":"0x4011ad","bytes":"4889c7","mnemonic":"MOV","operands":"RDI,RAX","size":3},{"address":"0x4011b0","bytes":"e816000000","mnemonic":"CALL","operands":"0x004011cb","size":5},{"address":"0x4011b5","bytes":"4889df","mnemonic":"MOV","operands":"RDI,RBX","size":3},{"address":"0x4011b8","bytes":"e8b3feffff","mnemonic":"CALL","operands":"0x00401070","size":5},{"address":"0x4011bd","bytes":"b800000000","mnemonic":"MOV","operands":"EAX,0x0","size":5},{"address":"0x4011c2","bytes":"5b","mnemonic":"POP","operands":"RBX","size":1},{"address":"0x4011c3","bytes":"c3","mnemonic":"RET","operands":"","size":1},{"address":"0x4011c4","bytes":"b801000000","mnemonic":"MOV","operands":"EAX,0x1","size":5},{"address":"0x4011c9","bytes":"ebf7","mnemonic":"JMP","operands":"0x004011c2","size":2}],"name":"main","name_origin":"imported","ranges":[{"end":"0x4011cb","start":"0x401196"}]},{"decompilation":{"status":"ok","text":"\nvoid apply(wchar_t *param_1)\n\n{\n  size_t sVar1;\n  \n  sVar1 = wcslen(L\"AB\");\n  wmemset(param_1,L'A',sVar1 + 1);\n  return;\n}\n\n"},"entry":"0x4011cb","instructions":[{"address":"0x4011cb","bytes":"f30f1efa","mnemonic":"ENDBR64","operands":"","size":4},{"address":"0x4011cf","bytes":"53","mnemonic":"PUSH","operands":"RBX","size":1},{"address":"0x4011d0","bytes":"4889fb","mnemonic":"MOV","operands":"RBX,RDI","size":3},{"address":"0x4011d3","bytes":"bf04204000","mnemonic":"MOV","operands":"EDI,0x402004","size":5},{"address":"0x4011d8","bytes":"e8a3feffff","mnemonic":"CALL","operands":"0x00401080","size":5},{"address":"0x4011dd","bytes":"488d5001","mnemonic":"LEA","operands":"RDX,[RAX + 0x1]","size":4},{"address":"0x4011e1","bytes":"be41000000","mnemonic":"MOV","operands":"ESI,0x41","size":5},{"address":"0x4011e6","bytes":"4889df","mnemonic":"MOV","operands":"RDI,RBX","size":3},{"address":"0x4011e9","bytes":"e8a2feffff","mnemonic":"CALL","operands":"0x00401090","size":5},{"address":"0x4011ee","bytes":"5b","mnemonic":"POP","operands":"RBX","size":1},{"address":"0x4011ef","bytes":"c3","mnemonic":"RET","operands":"","size":1}],"name":"apply","name_origin":"imported","ranges":[{"end":"0x4011f0","start":"0x4011cb"}]}],"policy_id":"entry-closure-v1","schema_version":2,"status":"available","unresolved_transfers":[]}
