{"schema_version":2,"architecture":"x86-64","policy_id":"entry-closure-v1","status":"available","entry_address":"0x401090","assumptions":["One invocation of the localized entry; no concurrent mutation or library interposition.","System V x86-64 ABI and ordinary libc allocation, string and output semantics.","Decompiler types and referenced-data windows are uncertain recovery, not proven object bounds."],"functions":[{"entry":"0x401090","name":"FUN_00401090","name_origin":"default","ranges":[{"start":"0x401090","end":"0x4010c2"}],"instructions":[{"address":"0x401090","size":4,"bytes":"f30f1efa","mnemonic":"ENDBR64","operands":""},{"address":"0x401094","size":1,"bytes":"53","mnemonic":"PUSH","operands":"RBX"},{"address":"0x401095","size":5,"bytes":"bf10000000","mnemonic":"MOV","operands":"EDI,0x10"},{"address":"0x40109a","size":5,"bytes":"e8e1ffffff","mnemonic":"CALL","operands":"0x00401080"},{"address":"0x40109f","size":3,"bytes":"4885c0","mnemonic":"TEST","operands":"RAX,RAX"},{"address":"0x4010a2","size":2,"bytes":"7417","mnemonic":"JZ","operands":"0x004010bb"},{"address":"0x4010a4","size":3,"bytes":"4889c3","mnemonic":"MOV","operands":"RBX,RAX"},{"address":"0x4010a7","size":3,"bytes":"4889c7","mnemonic":"MOV","operands":"RDI,RAX"},{"address":"0x4010aa","size":5,"bytes":"e811010000","mnemonic":"CALL","operands":"0x004011c0"},{"address":"0x4010af","size":3,"bytes":"4889df","mnemonic":"MOV","operands":"RDI,RBX"},{"address":"0x4010b2","size":5,"bytes":"e8a9ffffff","mnemonic":"CALL","operands":"0x00401060"},{"address":"0x4010b7","size":2,"bytes":"31c0","mnemonic":"XOR","operands":"EAX,EAX"},{"address":"0x4010b9","size":1,"bytes":"5b","mnemonic":"POP","operands":"RBX"},{"address":"0x4010ba","size":1,"bytes":"c3","mnemonic":"RET","operands":""},{"address":"0x4010bb","size":5,"bytes":"b801000000","mnemonic":"MOV","operands":"EAX,0x1"},{"address":"0x4010c0","size":1,"bytes":"5b","mnemonic":"POP","operands":"RBX"},{"address":"0x4010c1","size":1,"bytes":"c3","mnemonic":"RET","operands":""}],"decompilation":{"status":"ok","text":"\nundefined8 FUN_00401090(void)\n\n{\n  void *__ptr;\n  \n  __ptr = malloc(0x10);\n  if (__ptr != (void *)0x0) {\n    FUN_004011c0(__ptr);\n    free(__ptr);\n    return 0;\n  }\n  return 1;\n}\n\n"}},{"entry":"0x4011c0","name":"FUN_004011c0","name_origin":"default","ranges":[{"start":"0x4011c0","end":"0x4011ce"}],"instructions":[{"address":"0x4011c0","size":4,"bytes":"f30f1efa","mnemonic":"ENDBR64","operands":""},{"address":"0x4011c4","size":5,"bytes":"be04204000","mnemonic":"MOV","operands":"ESI,0x402004"},{"address":"0x4011c9","size":5,"bytes":"e9a2feffff","mnemonic":"JMP","operands":"0x00401070"}],"decompilation":{"status":"ok","text":"\nvoid FUN_004011c0(wchar_t *param_1)\n\n{\n  wcscpy(param_1,L\"AB\");\n  return;\n}\n\n"}}],"calls":[{"caller":"0x401090","site":"0x40109a","target_address":"0x401080","target_name":"malloc","kind":"call","resolution":"external","target_entry":null},{"caller":"0x401090","site":"0x4010aa","target_address":"0x4011c0","target_name":"FUN_004011c0","kind":"call","resolution":"application","target_entry":"0x4011c0"},{"caller":"0x401090","site":"0x4010b2","target_address":"0x401060","target_name":"free","kind":"call","resolution":"external","target_entry":null},{"caller":"0x4011c0","site":"0x4011c9","target_address":"0x401070","target_name":"wcscpy","kind":"tail","resolution":"external","target_entry":null}],"data":[{"address":"0x402004","bytes":"41000000420000000000000000000000","string_prefix":"A","size":16,"writable":false,"storage":"initialized","extent_status":"unknown_window","recovered_type":"unknown","interpretation":"uncertain_binary_recovery_not_an_object_bound","references":["0x4011c4"],"truncated":false}],"unresolved_transfers":[],"completeness":{"traversal":"complete","data":"uncertain","decompilation":"complete","external_bodies":"excluded","localization":"private_entry_address","omissions":[]}}
