{"schema_version":2,"architecture":"x86-64","policy_id":"entry-closure-v1","status":"available","entry_address":"0x401176","assumptions":["One invocation of the localized entry; no concurrent mutation or library interposition.","System V x86-64 ABI and ordinary libc allocation, string and output semantics.","Decompiler types and referenced-data windows are uncertain recovery, not proven object bounds."],"functions":[{"entry":"0x401176","name":"main","name_origin":"imported","ranges":[{"start":"0x401176","end":"0x4011bd"}],"instructions":[{"address":"0x401176","size":4,"bytes":"f30f1efa","mnemonic":"ENDBR64","operands":""},{"address":"0x40117a","size":1,"bytes":"55","mnemonic":"PUSH","operands":"RBP"},{"address":"0x40117b","size":3,"bytes":"4889e5","mnemonic":"MOV","operands":"RBP,RSP"},{"address":"0x40117e","size":4,"bytes":"4883ec10","mnemonic":"SUB","operands":"RSP,0x10"},{"address":"0x401182","size":5,"bytes":"bf10000000","mnemonic":"MOV","operands":"EDI,0x10"},{"address":"0x401187","size":5,"bytes":"e8f4feffff","mnemonic":"CALL","operands":"0x00401080"},{"address":"0x40118c","size":4,"bytes":"488945f8","mnemonic":"MOV","operands":"qword ptr [RBP + -0x8],RAX"},{"address":"0x401190","size":5,"bytes":"48837df800","mnemonic":"CMP","operands":"qword ptr [RBP + -0x8],0x0"},{"address":"0x401195","size":2,"bytes":"7507","mnemonic":"JNZ","operands":"0x0040119e"},{"address":"0x401197","size":5,"bytes":"b801000000","mnemonic":"MOV","operands":"EAX,0x1"},{"address":"0x40119c","size":2,"bytes":"eb1d","mnemonic":"JMP","operands":"0x004011bb"},{"address":"0x40119e","size":4,"bytes":"488b45f8","mnemonic":"MOV","operands":"RAX,qword ptr [RBP + -0x8]"},{"address":"0x4011a2","size":3,"bytes":"4889c7","mnemonic":"MOV","operands":"RDI,RAX"},{"address":"0x4011a5","size":5,"bytes":"e813000000","mnemonic":"CALL","operands":"0x004011bd"},{"address":"0x4011aa","size":4,"bytes":"488b45f8","mnemonic":"MOV","operands":"RAX,qword ptr [RBP + -0x8]"},{"address":"0x4011ae","size":3,"bytes":"4889c7","mnemonic":"MOV","operands":"RDI,RAX"},{"address":"0x4011b1","size":5,"bytes":"e8aafeffff","mnemonic":"CALL","operands":"0x00401060"},{"address":"0x4011b6","size":5,"bytes":"b800000000","mnemonic":"MOV","operands":"EAX,0x0"},{"address":"0x4011bb","size":1,"bytes":"c9","mnemonic":"LEAVE","operands":""},{"address":"0x4011bc","size":1,"bytes":"c3","mnemonic":"RET","operands":""}],"decompilation":{"status":"ok","text":"\nbool main(void)\n\n{\n  void *__ptr;\n  \n  __ptr = malloc(0x10);\n  if (__ptr != (void *)0x0) {\n    apply(__ptr);\n    free(__ptr);\n  }\n  return __ptr == (void *)0x0;\n}\n\n"}},{"entry":"0x4011bd","name":"apply","name_origin":"imported","ranges":[{"start":"0x4011bd","end":"0x4011e6"}],"instructions":[{"address":"0x4011bd","size":4,"bytes":"f30f1efa","mnemonic":"ENDBR64","operands":""},{"address":"0x4011c1","size":1,"bytes":"55","mnemonic":"PUSH","operands":"RBP"},{"address":"0x4011c2","size":3,"bytes":"4889e5","mnemonic":"MOV","operands":"RBP,RSP"},{"address":"0x4011c5","size":4,"bytes":"4883ec10","mnemonic":"SUB","operands":"RSP,0x10"},{"address":"0x4011c9","size":4,"bytes":"48897df8","mnemonic":"MOV","operands":"qword ptr [RBP + -0x8],RDI"},{"address":"0x4011cd","size":4,"bytes":"488b45f8","mnemonic":"MOV","operands":"RAX,qword ptr [RBP + -0x8]"},{"address":"0x4011d1","size":5,"bytes":"ba03000000","mnemonic":"MOV","operands":"EDX,0x3"},{"address":"0x4011d6","size":5,"bytes":"be41000000","mnemonic":"MOV","operands":"ESI,0x41"},{"address":"0x4011db","size":3,"bytes":"4889c7","mnemonic":"MOV","operands":"RDI,RAX"},{"address":"0x4011de","size":5,"bytes":"e88dfeffff","mnemonic":"CALL","operands":"0x00401070"},{"address":"0x4011e3","size":1,"bytes":"90","mnemonic":"NOP","operands":""},{"address":"0x4011e4","size":1,"bytes":"c9","mnemonic":"LEAVE","operands":""},{"address":"0x4011e5","size":1,"bytes":"c3","mnemonic":"RET","operands":""}],"decompilation":{"status":"ok","text":"\nvoid apply(wchar_t *param_1)\n\n{\n  wmemset(param_1,L'A',3);\n  return;\n}\n\n"}}],"calls":[{"caller":"0x401176","site":"0x401187","target_address":"0x401080","target_name":"malloc","kind":"call","resolution":"external","target_entry":null},{"caller":"0x401176","site":"0x4011a5","target_address":"0x4011bd","target_name":"apply","kind":"call","resolution":"application","target_entry":"0x4011bd"},{"caller":"0x401176","site":"0x4011b1","target_address":"0x401060","target_name":"free","kind":"call","resolution":"external","target_entry":null},{"caller":"0x4011bd","site":"0x4011de","target_address":"0x401070","target_name":"wmemset","kind":"call","resolution":"external","target_entry":null}],"data":[],"unresolved_transfers":[],"completeness":{"traversal":"complete","data":"complete","decompilation":"complete","external_bodies":"excluded","localization":"private_entry_address","omissions":[]}}
